{
  "id": "sample-platform-event-2026",
  "title": "Sample Verified AI Hackathon",
  "source": "sample-platform",
  "official_url": "https://example.com/hackathon",
  "organizer": "Example Organizer",
  "status": "verified",
  "discovered_at": "2026-07-10T12:00:00Z",
  "verified_at": "2026-07-10T13:00:00Z",
  "registration_deadline_utc": "2026-08-01T12:00:00Z",
  "submission_deadline_utc": "2026-08-10T12:00:00Z",
  "mode": "online",
  "location": null,
  "languages": ["English"],
  "eligibility": ["Global participants"],
  "team_size": { "min": 1, "max": 4 },
  "tracks": ["AI agents"],
  "required_technology": ["Sponsor API"],
  "allowed_preexisting_work": "partial",
  "deliverables": ["repository", "demo_url", "video"],
  "ip_and_license_summary": "Participant retains project ownership; event-specific rules still require human review.",
  "prize_and_network_value": "Sample value used only to exercise the validator.",
  "estimated_cost": 0,
  "estimated_team_hours": 48,
  "fit_assets": ["agent-team-os"],
  "hard_filter": "pass",
  "score": 82,
  "confidence": "medium",
  "evidence": ["https://example.com/hackathon/rules"],
  "human_gates": ["registration", "terms", "submission"]
}
